{
  "compatibility_posture": "compatible",
  "execution_mode": "live",
  "export_id": "exp_9275301050bcc8c0",
  "included_artifacts": [
    {
      "archive_path": "evidence/evidence_bundle.json",
      "logical_name": "evidence_bundle",
      "sha256": "d18c52bb9e13fd9b7901eb08973de75511a14f008cdc11f812564367aca43580",
      "source_path": "harness/evidence/slice_06_evidence_rcpt_bb355d9c41e2ca11.json"
    },
    {
      "archive_path": "observed/packet.json",
      "logical_name": "packet",
      "sha256": "d8f352f1de7326920df30b43a3f2ad7ee5e7eae3ed9dc63c69fe35587e399ffc"
    },
    {
      "archive_path": "observed/receipt.json",
      "logical_name": "receipt",
      "sha256": "46e718f2f6fc8e7898498dc8c97ebfd3fddf47012f176e960fe21905e7bd468e"
    },
    {
      "archive_path": "replay/request.json",
      "logical_name": "replay_request",
      "sha256": "a9b4b78b91c12ddbddc121c399fd75ed2451a3f88859cbb59ea5f8b88935db78"
    },
    {
      "archive_path": "telemetry/runtime_manifest.json",
      "logical_name": "telemetry_manifest",
      "sha256": "8c2699b699c16559fb2665c13909ca8a7116628feb3a9d41df00cd14cc45c8f9",
      "source_path": "harness/telemetry/slice_06_manifest.json"
    },
    {
      "archive_path": "telemetry/runtime_report.json",
      "logical_name": "telemetry_report",
      "sha256": "c8579019a7a8f4c0c96605169def943457789da1f6b64409bc6b43bb4b0d14aa",
      "source_path": "harness/telemetry/slice_06_runtime_report_rcpt_bb355d9c41e2ca11.json"
    }
  ],
  "manifest_filename": "slice_07_export_manifest_rcpt_bb355d9c41e2ca11.json",
  "package_label": "operator_replay",
  "packet_class": "search_assist_packet",
  "packet_id": "pkt_b41862d60ed898ff",
  "receipt_id": "rcpt_bb355d9c41e2ca11",
  "replay_package_filename": "slice_07_replay_package_rcpt_bb355d9c41e2ca11.zip",
  "replay_request_archive_path": "replay/request.json",
  "request_id": "req_c17f4d20ebf9fa48",
  "result_kind": "success",
  "schema_version": "1.0.0",
  "source_lineage_digest": {
    "digest": "4d1609fb71dcb0cf194408ffc764e3cacd0ee328e6aebbb9db7ee3ed9df2ec07",
    "digest_algorithm": "sha256",
    "source_scope": "request"
  },
  "trace_id": "trace_46b53f0ac7d87d7c",
  "version_set": {
    "budget_version": "v1_lock",
    "compatibility_posture": "compatible",
    "contract_version": "1.0.0",
    "corpus_version": "starter",
    "runtime_version": "slice_06"
  }
}
