{
  "schema_version": "1.0.0",
  "export_id": "exp_12345678abcd",
  "package_label": "operator_replay",
  "result_kind": "success",
  "request_id": "req_12345678abcd",
  "trace_id": "trace_12345678abcd",
  "receipt_id": "rcpt_12345678abcd",
  "packet_id": "pkt_12345678abcd",
  "packet_class": "answer_packet",
  "execution_mode": "replay",
  "replay_package_filename": "slice_07_replay_package_rcpt_12345678abcd.zip",
  "manifest_filename": "slice_07_export_manifest_rcpt_12345678abcd.json",
  "replay_request_archive_path": "replay/request.json",
  "version_set": {
    "contract_version": "1.0.0",
    "runtime_version": "slice_07",
    "corpus_version": "starter",
    "budget_version": "v1_lock",
    "compatibility_posture": "compatible"
  },
  "source_lineage_digest": {
    "digest_algorithm": "sha256",
    "digest": "1111111111111111111111111111111111111111111111111111111111111111",
    "source_scope": "request"
  },
  "compatibility_posture": "compatible",
  "included_artifacts": [
    {
      "logical_name": "replay_request",
      "archive_path": "replay/request.json",
      "sha256": "aaaaaaaaaaaaaaaaaaaaaaaaaaaaaaaaaaaaaaaaaaaaaaaaaaaaaaaaaaaaaaaa"
    },
    {
      "logical_name": "packet",
      "archive_path": "observed/packet.json",
      "sha256": "bbbbbbbbbbbbbbbbbbbbbbbbbbbbbbbbbbbbbbbbbbbbbbbbbbbbbbbbbbbbbbbb"
    },
    {
      "logical_name": "receipt",
      "archive_path": "observed/receipt.json",
      "sha256": "cccccccccccccccccccccccccccccccccccccccccccccccccccccccccccccccc"
    }
  ]
}
