{
  "compatibility_posture": "compatible",
  "execution_mode": "live",
  "export_id": "exp_8d4e7850c0759740",
  "included_artifacts": [
    {
      "archive_path": "evidence/evidence_bundle.json",
      "logical_name": "evidence_bundle",
      "sha256": "ce9dab6107563911f3edc1cd663ed9014ee078f0640ac233aa1cbbe3c1c8d949",
      "source_path": "harness/evidence/slice_06_evidence_rcpt_1ae7ddadb1e68689.json"
    },
    {
      "archive_path": "observed/packet.json",
      "logical_name": "packet",
      "sha256": "272e55fa059f81b2fac6eb895f344aba3a2253b6d2395966f6a683a7ab937314"
    },
    {
      "archive_path": "observed/receipt.json",
      "logical_name": "receipt",
      "sha256": "ec0dc355fc7867aa8eccab9e958bba731800fcfee23c219d0b5af2138e690848"
    },
    {
      "archive_path": "replay/request.json",
      "logical_name": "replay_request",
      "sha256": "69afd632815c17a939c4dbc9becf4af2298583811be666a0768487dde2d406db"
    },
    {
      "archive_path": "telemetry/runtime_manifest.json",
      "logical_name": "telemetry_manifest",
      "sha256": "7003778bb429baeb19b0a4099f9b7396ef619996361ee70afd1dff7aa7f7947d",
      "source_path": "harness/telemetry/slice_06_manifest.json"
    },
    {
      "archive_path": "telemetry/runtime_report.json",
      "logical_name": "telemetry_report",
      "sha256": "5fb82e328f5f0cf4c86ef5db9725e70cab96e1010d016a7e03736ebd4d3e9251",
      "source_path": "harness/telemetry/slice_06_runtime_report_rcpt_1ae7ddadb1e68689.json"
    }
  ],
  "manifest_filename": "slice_07_export_manifest_rcpt_1ae7ddadb1e68689.json",
  "package_label": "operator_replay",
  "packet_class": "policy_response_packet",
  "packet_id": "fpkt_55ddd047ad7a88fa",
  "receipt_id": "rcpt_1ae7ddadb1e68689",
  "replay_package_filename": "slice_07_replay_package_rcpt_1ae7ddadb1e68689.zip",
  "replay_request_archive_path": "replay/request.json",
  "request_id": "req_60091c2a4cab3b5d",
  "result_kind": "safe_failure",
  "schema_version": "1.0.0",
  "source_lineage_digest": {
    "digest": "dce936bcf9909e517eb7ad0f8fbc41a975d93dbdc8fb67fdb7e928bda4917025",
    "digest_algorithm": "sha256",
    "source_scope": "request"
  },
  "trace_id": "trace_aefb8c1321bdfc65",
  "version_set": {
    "budget_version": "v1_lock",
    "compatibility_posture": "compatible",
    "contract_version": "1.0.0",
    "corpus_version": "starter",
    "runtime_version": "slice_06"
  }
}
