{
  "compatibility_posture": "compatible",
  "execution_mode": "live",
  "export_id": "exp_bd8699ad689ee88a",
  "included_artifacts": [
    {
      "archive_path": "observed/packet.json",
      "logical_name": "packet",
      "sha256": "c02b419c43a8901f9da5caf077b681910bcf738f925da86976ad3a69d51a7bcc"
    },
    {
      "archive_path": "observed/receipt.json",
      "logical_name": "receipt",
      "sha256": "6f9c80bf71d014cde72938730972160634bf306a03cb72fb2f94e73bd5dcc4a4"
    },
    {
      "archive_path": "replay/request.json",
      "logical_name": "replay_request",
      "sha256": "878698fa16b08f492ba43556436b68945536dada704e3e0f7f68ad0347a9b4af"
    }
  ],
  "manifest_filename": "slice_07_export_manifest_rcpt_45b25acebadad978.json",
  "package_label": "operator_replay",
  "packet_class": "search_assist_packet",
  "packet_id": "pkt_59b0e8485a00d85e",
  "receipt_id": "rcpt_45b25acebadad978",
  "replay_package_filename": "slice_07_replay_package_rcpt_45b25acebadad978.zip",
  "replay_request_archive_path": "replay/request.json",
  "request_id": "req_c17f4d20ebf9fa48",
  "result_kind": "success",
  "schema_version": "1.0.0",
  "source_lineage_digest": {
    "digest": "4d1609fb71dcb0cf194408ffc764e3cacd0ee328e6aebbb9db7ee3ed9df2ec07",
    "digest_algorithm": "sha256",
    "source_scope": "request"
  },
  "trace_id": "trace_17596eed79a61a64",
  "version_set": {
    "budget_version": "v1_lock",
    "compatibility_posture": "compatible",
    "contract_version": "1.0.0",
    "corpus_version": "starter",
    "runtime_version": "slice_06"
  }
}
