{
  "compatibility_posture": "compatible",
  "execution_mode": "live",
  "export_id": "exp_f4fed8fe38fa02b8",
  "included_artifacts": [
    {
      "archive_path": "evidence/evidence_bundle.json",
      "logical_name": "evidence_bundle",
      "sha256": "c08ef8ad58ac0c78cdd6670f6967dc40352e753063709990987ab35133f4b2b6",
      "source_path": "harness/evidence/slice_06_evidence_rcpt_0990c0414b9fec53.json"
    },
    {
      "archive_path": "observed/packet.json",
      "logical_name": "packet",
      "sha256": "38f69cd22b4a620074e4f551516073dd571b4accd86f2a80bec19d75f14a5bc2"
    },
    {
      "archive_path": "observed/receipt.json",
      "logical_name": "receipt",
      "sha256": "fb349b9d2d4ab7e16b20bf1ed1e13bd8a8ad57d2fe3af167d47c2d3f20c5dac3"
    },
    {
      "archive_path": "replay/request.json",
      "logical_name": "replay_request",
      "sha256": "a9b4b78b91c12ddbddc121c399fd75ed2451a3f88859cbb59ea5f8b88935db78"
    },
    {
      "archive_path": "telemetry/runtime_manifest.json",
      "logical_name": "telemetry_manifest",
      "sha256": "1d2faea25f23a18c6f8dab62b324afb8369c0a939ce7618be2a0a1e1ba09158e",
      "source_path": "harness/telemetry/slice_06_manifest.json"
    },
    {
      "archive_path": "telemetry/runtime_report.json",
      "logical_name": "telemetry_report",
      "sha256": "9955b580ac4324984ecea8b2714edc83ba85f51c9d1fcfbab5e4204c154bb93a",
      "source_path": "harness/telemetry/slice_06_runtime_report_rcpt_0990c0414b9fec53.json"
    }
  ],
  "manifest_filename": "slice_07_export_manifest_rcpt_0990c0414b9fec53.json",
  "package_label": "operator_replay",
  "packet_class": "search_assist_packet",
  "packet_id": "pkt_90a2963a1254ca45",
  "receipt_id": "rcpt_0990c0414b9fec53",
  "replay_package_filename": "slice_07_replay_package_rcpt_0990c0414b9fec53.zip",
  "replay_request_archive_path": "replay/request.json",
  "request_id": "req_c17f4d20ebf9fa48",
  "result_kind": "success",
  "schema_version": "1.0.0",
  "source_lineage_digest": {
    "digest": "4d1609fb71dcb0cf194408ffc764e3cacd0ee328e6aebbb9db7ee3ed9df2ec07",
    "digest_algorithm": "sha256",
    "source_scope": "request"
  },
  "trace_id": "trace_c35f5f7cc1de9224",
  "version_set": {
    "budget_version": "v1_lock",
    "compatibility_posture": "compatible",
    "contract_version": "1.0.0",
    "corpus_version": "starter",
    "runtime_version": "slice_06"
  }
}
