{
  "compatibility_posture": "compatible",
  "execution_mode": "replay",
  "export_id": "exp_f2435e946e3fdcd7",
  "included_artifacts": [
    {
      "archive_path": "evidence/evidence_bundle.json",
      "logical_name": "evidence_bundle",
      "sha256": "354364fe644e48aea7b02a747f8610aced170c89e0a90a579b4de42fecaff8e4",
      "source_path": "harness/evidence/slice_06_evidence_rcpt_e9c8c7122534668a.json"
    },
    {
      "archive_path": "observed/packet.json",
      "logical_name": "packet",
      "sha256": "d26259295e57c6431dba64bd75f0f40d664e12dabbfe2d404f53d47cf0bf6c84"
    },
    {
      "archive_path": "observed/receipt.json",
      "logical_name": "receipt",
      "sha256": "23ad2b9d47e4f6790fa129e0b0c8353e60be91cb1797556f8d1469db1db49a52"
    },
    {
      "archive_path": "replay/request.json",
      "logical_name": "replay_request",
      "sha256": "d5985e62d6c32bb63f02e20c9c2a52b6f6ac944090dace672ebbb14241047797"
    },
    {
      "archive_path": "telemetry/runtime_manifest.json",
      "logical_name": "telemetry_manifest",
      "sha256": "09f43d355798dde8b2327fc8aa6aab2f3fadaba860593fafd1ccea5a98b49390",
      "source_path": "harness/telemetry/slice_06_manifest.json"
    },
    {
      "archive_path": "telemetry/runtime_report.json",
      "logical_name": "telemetry_report",
      "sha256": "c0bf3c24394d85da6276d72ddf2c20fdbe28d8a8c23d0b7dd500e5d2754c46f1",
      "source_path": "harness/telemetry/slice_06_runtime_report_rcpt_e9c8c7122534668a.json"
    }
  ],
  "manifest_filename": "slice_07_export_manifest_rcpt_e9c8c7122534668a.json",
  "package_label": "operator_replay",
  "packet_class": "answer_packet",
  "packet_id": "pkt_b5688d6beedb0bb4",
  "receipt_id": "rcpt_e9c8c7122534668a",
  "replay_package_filename": "slice_07_replay_package_rcpt_e9c8c7122534668a.zip",
  "replay_request_archive_path": "replay/request.json",
  "request_id": "req_8ef0dcf5925fbb9c",
  "result_kind": "success",
  "schema_version": "1.0.0",
  "source_lineage_digest": {
    "digest": "5811829d23f43af0e9b6dbe0eb3a2e7525e908e70716065b072fdac2985f4fb5",
    "digest_algorithm": "sha256",
    "source_scope": "request"
  },
  "trace_id": "trace_cee4ebaabfd06c84",
  "version_set": {
    "budget_version": "v1_lock",
    "compatibility_posture": "compatible",
    "contract_version": "1.0.0",
    "corpus_version": "starter",
    "runtime_version": "slice_06"
  }
}
