{
  "compatibility_posture": "compatible",
  "execution_mode": "live",
  "export_id": "exp_3d6a094cab6059d8",
  "included_artifacts": [
    {
      "archive_path": "evidence/evidence_bundle.json",
      "logical_name": "evidence_bundle",
      "sha256": "129d3bb8e99608da0da103528cbeecc5f73878c612d935ee251b455f35b824bb",
      "source_path": "harness/evidence/slice_06_evidence_rcpt_8a3e24f3de7506b1.json"
    },
    {
      "archive_path": "observed/packet.json",
      "logical_name": "packet",
      "sha256": "a9050cfd11b45897dd65592f45c55dfcc696504406cc05e2b7b6016a0060f315"
    },
    {
      "archive_path": "observed/receipt.json",
      "logical_name": "receipt",
      "sha256": "6eb46bfb403191820fed188bb3ba138425c8f619f59cb9f623f576fa8e60faa1"
    },
    {
      "archive_path": "replay/request.json",
      "logical_name": "replay_request",
      "sha256": "a6ee0b09ee307736026c1f3ed7d27ba7bc9f1c90216a7908194ed4cae65e6f47"
    },
    {
      "archive_path": "telemetry/runtime_manifest.json",
      "logical_name": "telemetry_manifest",
      "sha256": "70572efa94a0eda67e41f6e2e139aafb54d9cc7480b564c5bdf538d12f78e9b3",
      "source_path": "harness/telemetry/slice_06_manifest.json"
    },
    {
      "archive_path": "telemetry/runtime_report.json",
      "logical_name": "telemetry_report",
      "sha256": "53643a79ac00908c64b5cf221a1368721ac837241de1fecbbbf23ee6cd4744e4",
      "source_path": "harness/telemetry/slice_06_runtime_report_rcpt_8a3e24f3de7506b1.json"
    }
  ],
  "manifest_filename": "slice_07_export_manifest_rcpt_8a3e24f3de7506b1.json",
  "package_label": "operator_replay",
  "packet_class": "policy_response_packet",
  "packet_id": "pkt_41593cab9d95af49",
  "receipt_id": "rcpt_8a3e24f3de7506b1",
  "replay_package_filename": "slice_07_replay_package_rcpt_8a3e24f3de7506b1.zip",
  "replay_request_archive_path": "replay/request.json",
  "request_id": "req_6434ff84e7e891be",
  "result_kind": "success",
  "schema_version": "1.0.0",
  "source_lineage_digest": {
    "digest": "9be50da6e3e3b13d5c16401e135d9c2b506d3beb1a5f835836f9c9608a8ac9f3",
    "digest_algorithm": "sha256",
    "source_scope": "request"
  },
  "trace_id": "trace_a4510a5aaa47ee5c",
  "version_set": {
    "budget_version": "v1_lock",
    "compatibility_posture": "compatible",
    "contract_version": "1.0.0",
    "corpus_version": "starter",
    "runtime_version": "slice_06"
  }
}
