{
  "compatibility_posture": "compatible",
  "execution_mode": "live",
  "export_id": "exp_9bc203b69e9b9ec6",
  "included_artifacts": [
    {
      "archive_path": "evidence/evidence_bundle.json",
      "logical_name": "evidence_bundle",
      "sha256": "8f76e2e5278b2d2eef54522f80203a91f1e0c33b66f20ff6473e66b5cf750c52",
      "source_path": "harness/evidence/slice_06_evidence_rcpt_83c93bd52dc41068.json"
    },
    {
      "archive_path": "observed/packet.json",
      "logical_name": "packet",
      "sha256": "f571a1d12f47c7a7019f56dd8e999fbb1f65c730bb1e03f5a146e3da8e7acd29"
    },
    {
      "archive_path": "observed/receipt.json",
      "logical_name": "receipt",
      "sha256": "6f42d0ebb358724ea6cfbda28a31d6fbca2bbdbe5b7bc4dd5ad42ac07144224c"
    },
    {
      "archive_path": "replay/request.json",
      "logical_name": "replay_request",
      "sha256": "a6ee0b09ee307736026c1f3ed7d27ba7bc9f1c90216a7908194ed4cae65e6f47"
    },
    {
      "archive_path": "telemetry/runtime_manifest.json",
      "logical_name": "telemetry_manifest",
      "sha256": "9427cb9185695f359f2476f9ec19c911720ddd7a0ce3e111551ba4d64a39fb92",
      "source_path": "harness/telemetry/slice_06_manifest.json"
    },
    {
      "archive_path": "telemetry/runtime_report.json",
      "logical_name": "telemetry_report",
      "sha256": "251096e5330674e565122e5473ede5e3c4ad30a7a4730adbf93470017e79ae71",
      "source_path": "harness/telemetry/slice_06_runtime_report_rcpt_83c93bd52dc41068.json"
    }
  ],
  "manifest_filename": "slice_07_export_manifest_rcpt_83c93bd52dc41068.json",
  "package_label": "operator_replay",
  "packet_class": "policy_response_packet",
  "packet_id": "pkt_c5ae8ba8d146760d",
  "receipt_id": "rcpt_83c93bd52dc41068",
  "replay_package_filename": "slice_07_replay_package_rcpt_83c93bd52dc41068.zip",
  "replay_request_archive_path": "replay/request.json",
  "request_id": "req_6434ff84e7e891be",
  "result_kind": "success",
  "schema_version": "1.0.0",
  "source_lineage_digest": {
    "digest": "9be50da6e3e3b13d5c16401e135d9c2b506d3beb1a5f835836f9c9608a8ac9f3",
    "digest_algorithm": "sha256",
    "source_scope": "request"
  },
  "trace_id": "trace_fd2e99c9e3ac6ad3",
  "version_set": {
    "budget_version": "v1_lock",
    "compatibility_posture": "compatible",
    "contract_version": "1.0.0",
    "corpus_version": "starter",
    "runtime_version": "slice_06"
  }
}
