{
  "compatibility_posture": "compatible",
  "execution_mode": "live",
  "export_id": "exp_0a495bdc2cbe83e2",
  "included_artifacts": [
    {
      "archive_path": "evidence/evidence_bundle.json",
      "logical_name": "evidence_bundle",
      "sha256": "133365cec1f61d75d98e6bf57c9d6246da4703336e534930b6791b2ea924fc66",
      "source_path": "harness/evidence/slice_06_evidence_rcpt_d18e33cda28dc140.json"
    },
    {
      "archive_path": "observed/packet.json",
      "logical_name": "packet",
      "sha256": "6cef703f41cc331092cceee455510f7acc19fa682661802d22a1f048bac1135f"
    },
    {
      "archive_path": "observed/receipt.json",
      "logical_name": "receipt",
      "sha256": "30ddc54662b760c7a31bbf377503ace06869ffe6bb76bf727f94b2797e61f0d0"
    },
    {
      "archive_path": "replay/request.json",
      "logical_name": "replay_request",
      "sha256": "69afd632815c17a939c4dbc9becf4af2298583811be666a0768487dde2d406db"
    },
    {
      "archive_path": "telemetry/runtime_manifest.json",
      "logical_name": "telemetry_manifest",
      "sha256": "3fffca0791eee531d03fe70bc541b04d6aed8d908ad7146456024316871016c8",
      "source_path": "harness/telemetry/slice_06_manifest.json"
    },
    {
      "archive_path": "telemetry/runtime_report.json",
      "logical_name": "telemetry_report",
      "sha256": "5517a7e64d37b938edace2da863250576101f6b5a2d5bd113cf0cea289529174",
      "source_path": "harness/telemetry/slice_06_runtime_report_rcpt_d18e33cda28dc140.json"
    }
  ],
  "manifest_filename": "slice_07_export_manifest_rcpt_d18e33cda28dc140.json",
  "package_label": "operator_replay",
  "packet_class": "policy_response_packet",
  "packet_id": "fpkt_4a62005722088834",
  "receipt_id": "rcpt_d18e33cda28dc140",
  "replay_package_filename": "slice_07_replay_package_rcpt_d18e33cda28dc140.zip",
  "replay_request_archive_path": "replay/request.json",
  "request_id": "req_60091c2a4cab3b5d",
  "result_kind": "safe_failure",
  "schema_version": "1.0.0",
  "source_lineage_digest": {
    "digest": "dce936bcf9909e517eb7ad0f8fbc41a975d93dbdc8fb67fdb7e928bda4917025",
    "digest_algorithm": "sha256",
    "source_scope": "request"
  },
  "trace_id": "trace_bca86669607b23d1",
  "version_set": {
    "budget_version": "v1_lock",
    "compatibility_posture": "compatible",
    "contract_version": "1.0.0",
    "corpus_version": "starter",
    "runtime_version": "slice_06"
  }
}
